code,name,descr,lang_code,is_active,cr_by,cr_dtimes
FNR,Fingerprint,Finger prints of the applicant,eng,TRUE,superadmin,now()
IRS,Iris,Iris of the applicant,eng,TRUE,superadmin,now()
PHT,Photo,Photo of the face of the applicant,eng,TRUE,superadmin,now()
FNR,بصمة الإصبع,بصمات الأصابع لمقدم الطلب,ara,TRUE,superadmin,now()
IRS,قزحية العين,آيريس لمقدم الطلب,ara,TRUE,superadmin,now()
PHT,صور,صورة لوجه مقدم الطلب,ara,TRUE,superadmin,now()
FNR,Empreintes digitales,Empreintes digitales du demandeur,fra,TRUE,superadmin,now()
IRS,Iris,Iris du demandeur,fra,TRUE,superadmin,now()
PHT,Photo,Photo du visage du demandeur,fra,TRUE,superadmin,now()
